Quest Requirements;Item Requirements;Conversation ID;Dialogue;Repeat Requirements;Triggers
~;~;#snaps_day;You're trespassin' kid. You know where you're at?;~;~
~;~;#snaps_day;Last week this foul stench and dirty water come outta nowhere, and now you!;~;~
~;~;#snaps_day;Flake let you in? Damn that fly, constantly provokin' me!;~;~
~;~;#snaps_day;He's always invitin' people a little too close to my turf.;~;~
~;~;#snaps_day;The sewers are MY territory!;~;~
~;~;#snaps_day;That buzzin' bastard thinks he can do as he pleases.;~;~
~;~;#snaps_day;One of these days I'm gonna squash him.;~;~
~;~;#snaps_day;I'm already in a bad mood, now get out!;~;~
~;~;#snaps_repeat;What you still doin' here kid!? I told you to get lost!;~;~
